{
  "authority": {
    "approval": false,
    "automatic_selection": false,
    "board": false,
    "deployment": false,
    "doctrine": false,
    "execution": false,
    "policy": false,
    "promotion": false,
    "read": true,
    "repository_mutation": false,
    "retrieval_advisory": true,
    "routing_advisory": true,
    "scheduling": false,
    "synthesis_advisory": true
  },
  "candidate_projections": [
    {
      "candidate_id": "creation-os-bootstrap-pointer-not-memory",
      "classification": "playbook-review-candidate",
      "destination_authority": "proposal-only",
      "kind": "rule",
      "name": "Bootstrap Pointer, Not Memory",
      "owner_intake": {
        "admission": {
          "promotion_authority": "none",
          "state": "review-candidate",
          "suggested_destination_authority": "proposal-only"
        },
        "candidate_record_id": "playbook-akc-0db48d64ec1fb5a401d45b55",
        "consumer_receipt": {
          "atlas_validator": {
            "export": "./validator",
            "package": "@atlas/contracts",
            "schema": "atlas.knowledge-candidate.v2"
          },
          "candidate_content_sha256": "1787d8672266c30a0822a5a5025466e8aa9c264bbc6d23bb3b61d34389c3730f",
          "candidate_id": "creation-os-bootstrap-pointer-not-memory",
          "candidate_record_id": "playbook-akc-0db48d64ec1fb5a401d45b55",
          "correlation": {
            "candidate_id": "creation-os-bootstrap-pointer-not-memory",
            "candidate_record_id": "playbook-akc-0db48d64ec1fb5a401d45b55",
            "source_artifact_path": "data/knowledge-candidates/creation-os/creation-os-bootstrap-pointer-not-memory.knowledge-candidate.v2.json",
            "source_artifact_sha256": "sha256:71170a9442e24862e0f79876e3f8e7028c9146efe5a91bc20daacf1b3a679c05"
          },
          "decision": "candidate-only-admitted",
          "kind": "playbook.atlas-knowledge-candidate.consumer-receipt.v1",
          "owner_disposition": "accept",
          "promotion_authority": "none",
          "receipt_id": "playbook-akc-receipt-4fc34f7a000cac0eed01ce2f",
          "review_status": "candidate",
          "schema_version": "1.0",
          "source_artifact": {
            "path": "data/knowledge-candidates/creation-os/creation-os-bootstrap-pointer-not-memory.knowledge-candidate.v2.json",
            "sha256": "sha256:71170a9442e24862e0f79876e3f8e7028c9146efe5a91bc20daacf1b3a679c05"
          },
          "source_contract": "atlas.knowledge-candidate.v2",
          "suggested_destination": "Playbook/rules"
        },
        "disposition": {
          "decision": "accept",
          "effect": "candidate-review-only",
          "rationale": "Exact Atlas v2 artifact validated, supported destination retained, and admission grants no doctrine-promotion authority.",
          "reason_code": "PLAYBOOK_CANDIDATE_REVIEW_ACCEPTED"
        },
        "receipt_id": "playbook-akc-intake-creation-os-66f756768792"
      },
      "promotion_status": "not-promoted",
      "provenance": [
        {
          "classification": "verified",
          "ref": "git:fawxzzy/ATLAS@c376810ec75066fb6b21d950f56fcdf986421889:docs/ops/ATLAS-CREATION-OS-PLAYBOOK-PROMOTION-CANDIDATES-2026-07-16.md#creation-os-bootstrap-pointer-not-memory",
          "source_type": "repository"
        },
        {
          "classification": "verified",
          "ref": "git:fawxzzy/ATLAS@1d79d4ac3191dade11a2aa7c40352a5f210d35e2:docs/atlas/decisions/adr-signed-versioned-atlas-bootstrap-manifest.md",
          "source_type": "repository"
        },
        {
          "classification": "verified",
          "ref": "git:fawxzzy/ATLAS@1d79d4ac3191dade11a2aa7c40352a5f210d35e2:docs/architecture/STATE-AND-MEMORY-BOUNDARIES.md",
          "source_type": "repository"
        },
        {
          "classification": "reported",
          "ref": "git:fawxzzy/ATLAS@1d79d4ac3191dade11a2aa7c40352a5f210d35e2:data/imports/creation-os/deep-research-2026-07-16/deep-research-report.md#lines=7,218",
          "source_type": "external-source"
        },
        {
          "classification": "verified",
          "ref": "git:fawxzzy/playbook@8aa912b492e689fca4c296d59a438c2813cba4fc:packages/engine/src/memory/atlasCandidateAdmission.ts",
          "source_type": "repository"
        }
      ],
      "review": {
        "decision_note": null,
        "reviewed_at": null,
        "reviewer": null,
        "status": "candidate"
      },
      "scope": "recovery, profile/context bootstrap, memory, indexes, storage, and cross-machine restore.",
      "source": {
        "artifact_path": "data/knowledge-candidates/creation-os/creation-os-bootstrap-pointer-not-memory.knowledge-candidate.v2.json",
        "artifact_sha256": "sha256:71170a9442e24862e0f79876e3f8e7028c9146efe5a91bc20daacf1b3a679c05",
        "atlas_revision": "66f756768792de35ef00d1741cf8c6f6c965b733",
        "manifest_record_sha256": "sha256:51c608f096ffbcc7480bc06e027953ad7fe00d67e30ba20eccce089eddaa803f"
      },
      "statement": "The bootstrap artifact is a pointer into governed truth, never the entire memory system.",
      "suggested_destination": "Playbook/rules"
    },
    {
      "candidate_id": "creation-os-builder-creative-loop-separation",
      "classification": "playbook-review-candidate",
      "destination_authority": "proposal-only",
      "kind": "pattern",
      "name": "Builder and Creative Loop Separation",
      "owner_intake": {
        "admission": {
          "promotion_authority": "none",
          "state": "review-candidate",
          "suggested_destination_authority": "proposal-only"
        },
        "candidate_record_id": "playbook-akc-977164b00694cefc34b07b05",
        "consumer_receipt": {
          "atlas_validator": {
            "export": "./validator",
            "package": "@atlas/contracts",
            "schema": "atlas.knowledge-candidate.v2"
          },
          "candidate_content_sha256": "5d99b77776c15da7dad0847907a483285cf3cc574e9b06425a92eddfdda3b890",
          "candidate_id": "creation-os-builder-creative-loop-separation",
          "candidate_record_id": "playbook-akc-977164b00694cefc34b07b05",
          "correlation": {
            "candidate_id": "creation-os-builder-creative-loop-separation",
            "candidate_record_id": "playbook-akc-977164b00694cefc34b07b05",
            "source_artifact_path": "data/knowledge-candidates/creation-os/creation-os-builder-creative-loop-separation.knowledge-candidate.v2.json",
            "source_artifact_sha256": "sha256:8c50f2611698756850c88c15ff4ba3d3f09a8807378e4aeb339572842bf4d986"
          },
          "decision": "candidate-only-admitted",
          "kind": "playbook.atlas-knowledge-candidate.consumer-receipt.v1",
          "owner_disposition": "accept",
          "promotion_authority": "none",
          "receipt_id": "playbook-akc-receipt-9264f977b2cada4f13039f43",
          "review_status": "candidate",
          "schema_version": "1.0",
          "source_artifact": {
            "path": "data/knowledge-candidates/creation-os/creation-os-builder-creative-loop-separation.knowledge-candidate.v2.json",
            "sha256": "sha256:8c50f2611698756850c88c15ff4ba3d3f09a8807378e4aeb339572842bf4d986"
          },
          "source_contract": "atlas.knowledge-candidate.v2",
          "suggested_destination": "Playbook/patterns"
        },
        "disposition": {
          "decision": "accept",
          "effect": "candidate-review-only",
          "rationale": "Exact Atlas v2 artifact validated, supported destination retained, and admission grants no doctrine-promotion authority.",
          "reason_code": "PLAYBOOK_CANDIDATE_REVIEW_ACCEPTED"
        },
        "receipt_id": "playbook-akc-intake-creation-os-66f756768792"
      },
      "promotion_status": "not-promoted",
      "provenance": [
        {
          "classification": "verified",
          "ref": "git:fawxzzy/ATLAS@c376810ec75066fb6b21d950f56fcdf986421889:docs/ops/ATLAS-CREATION-OS-PLAYBOOK-PROMOTION-CANDIDATES-2026-07-16.md#creation-os-builder-creative-loop-separation",
          "source_type": "repository"
        },
        {
          "classification": "verified",
          "ref": "git:fawxzzy/ATLAS@1d79d4ac3191dade11a2aa7c40352a5f210d35e2:docs/architecture/ATLAS-CREATION-OS-TARGET-ARCHITECTURE.md#interaction-loops",
          "source_type": "repository"
        },
        {
          "classification": "verified",
          "ref": "git:fawxzzy/ATLAS@1d79d4ac3191dade11a2aa7c40352a5f210d35e2:docs/architecture/ATLAS-CHATGPT-CODEX-WORKFLOW.md",
          "source_type": "repository"
        },
        {
          "classification": "reported",
          "ref": "git:fawxzzy/ATLAS@1d79d4ac3191dade11a2aa7c40352a5f210d35e2:data/imports/creation-os/deep-research-2026-07-16/deep-research-report.md#lines=9,246",
          "source_type": "external-source"
        },
        {
          "classification": "verified",
          "ref": "git:fawxzzy/playbook@8aa912b492e689fca4c296d59a438c2813cba4fc:packages/engine/src/memory/atlasCandidateAdmission.ts",
          "source_type": "repository"
        }
      ],
      "review": {
        "decision_note": null,
        "reviewed_at": null,
        "reviewer": null,
        "status": "candidate"
      },
      "scope": "voice/text exploration, plans, code edits, tests, previews, receipts, merge, deploy, and publication.",
      "source": {
        "artifact_path": "data/knowledge-candidates/creation-os/creation-os-builder-creative-loop-separation.knowledge-candidate.v2.json",
        "artifact_sha256": "sha256:8c50f2611698756850c88c15ff4ba3d3f09a8807378e4aeb339572842bf4d986",
        "atlas_revision": "66f756768792de35ef00d1741cf8c6f6c965b733",
        "manifest_record_sha256": "sha256:f9d9b094e1d05a0888d6ec316bf1278be3251dedaa43dd51e15f04c6d4e12036"
      },